{
  "$schema": "https://json-schema.org/draft/2020-12/schema",
  "$id": "https://cloud-ai-security-skills.local/examples/agents/schemas/harness_profile.schema.json",
  "title": "LangGraph SOC harness profile",
  "type": "object",
  "additionalProperties": false,
  "required": [
    "profile_id",
    "description",
    "allowed_skills",
    "caller_context",
    "cloud_identity_hints",
    "llm",
    "model_policy",
    "approval_policy",
    "runtime"
  ],
  "properties": {
    "profile_id": {
      "type": "string",
      "pattern": "^[a-z0-9][a-z0-9-]{1,63}$"
    },
    "description": {
      "type": "string",
      "minLength": 1
    },
    "allowed_skills": {
      "type": "array",
      "minItems": 1,
      "uniqueItems": true,
      "items": {
        "type": "string",
        "minLength": 1
      }
    },
    "caller_context": {
      "type": "object",
      "additionalProperties": false,
      "required": [
        "user_id",
        "email",
        "session_id",
        "roles",
        "allowed_skills"
      ],
      "properties": {
        "user_id": {
          "type": "string",
          "minLength": 1
        },
        "email": {
          "type": "string",
          "minLength": 3
        },
        "session_id": {
          "type": "string",
          "minLength": 1
        },
        "roles": {
          "type": "string",
          "minLength": 1
        },
        "allowed_skills": {
          "type": "array",
          "minItems": 1,
          "uniqueItems": true,
          "items": {
            "type": "string",
            "minLength": 1
          }
        }
      }
    },
    "cloud_identity_hints": {
      "type": "object",
      "additionalProperties": {
        "type": "string",
        "minLength": 1
      }
    },
    "llm": {
      "type": "object",
      "additionalProperties": false,
      "required": [
        "mode",
        "provider",
        "model"
      ],
      "properties": {
        "mode": {
          "type": "string",
          "enum": [
            "deterministic_offline",
            "external_llm_optional"
          ]
        },
        "provider": {
          "type": "string",
          "minLength": 1
        },
        "model": {
          "type": "string",
          "minLength": 1
        }
      }
    },
    "token_budget": {
      "type": "object",
      "additionalProperties": false,
      "required": [
        "policy_version",
        "task_class",
        "model_tier",
        "max_input_tokens",
        "max_output_tokens",
        "max_total_tokens",
        "max_findings_per_call",
        "max_evidence_chars",
        "compression_required",
        "fallback_on_budget_exceeded"
      ],
      "properties": {
        "policy_version": {
          "type": "string",
          "const": "langgraph-token-budget-v1"
        },
        "task_class": {
          "type": "string",
          "const": "triage_summary"
        },
        "model_tier": {
          "type": "string",
          "enum": [
            "tiny",
            "small",
            "large"
          ]
        },
        "max_input_tokens": {
          "type": "integer",
          "minimum": 1
        },
        "max_output_tokens": {
          "type": "integer",
          "minimum": 1
        },
        "max_total_tokens": {
          "type": "integer",
          "minimum": 1
        },
        "max_findings_per_call": {
          "type": "integer",
          "minimum": 1
        },
        "max_evidence_chars": {
          "type": "integer",
          "minimum": 1
        },
        "compression_required": {
          "type": "boolean",
          "const": true
        },
        "fallback_on_budget_exceeded": {
          "type": "boolean",
          "const": true
        }
      }
    },
    "model_policy": {
      "type": "object",
      "additionalProperties": false,
      "required": [
        "policy_version",
        "task_class",
        "selection_strategy",
        "default_model_tier",
        "allowed_model_tiers",
        "models",
        "fallback"
      ],
      "properties": {
        "policy_version": {
          "type": "string",
          "const": "langgraph-model-policy-v1"
        },
        "task_class": {
          "type": "string",
          "const": "triage_summary"
        },
        "selection_strategy": {
          "type": "string",
          "const": "smallest_sufficient"
        },
        "default_model_tier": {
          "type": "string",
          "enum": [
            "tiny",
            "small",
            "large"
          ]
        },
        "allowed_model_tiers": {
          "type": "array",
          "minItems": 1,
          "uniqueItems": true,
          "items": {
            "type": "string",
            "enum": [
              "tiny",
              "small",
              "large"
            ]
          }
        },
        "models": {
          "type": "object",
          "additionalProperties": false,
          "required": [
            "tiny",
            "small",
            "large"
          ],
          "properties": {
            "tiny": {
              "$ref": "#/$defs/model_target"
            },
            "small": {
              "$ref": "#/$defs/model_target"
            },
            "large": {
              "$ref": "#/$defs/model_target"
            }
          }
        },
        "fallback": {
          "$ref": "#/$defs/model_target"
        }
      }
    },
    "agent_roster": {
      "type": "array",
      "minItems": 1,
      "uniqueItems": true,
      "items": {
        "$ref": "#/$defs/agent_roster_entry"
      }
    },
    "approval_policy": {
      "type": "object",
      "additionalProperties": false,
      "required": [
        "remediation_requires_approval_context",
        "approval_source"
      ],
      "properties": {
        "remediation_requires_approval_context": {
          "type": "boolean",
          "const": true
        },
        "approval_source": {
          "type": "string",
          "minLength": 1
        },
        "min_approvers": {
          "type": "integer",
          "minimum": 1
        }
      }
    },
    "runtime": {
      "type": "object",
      "additionalProperties": false,
      "required": [
        "langgraph_runtime_optional",
        "dry_run_default"
      ],
      "properties": {
        "langgraph_runtime_optional": {
          "type": "boolean",
          "const": true
        },
        "dry_run_default": {
          "type": "boolean",
          "const": true
        },
        "apply_supported": {
          "type": "boolean",
          "const": false
        },
        "security_data_source": {
          "type": "object",
          "additionalProperties": false,
          "required": [
            "mode",
            "backend",
            "source_skill"
          ],
          "properties": {
            "mode": {
              "type": "string",
              "enum": [
                "raw_ingest",
                "security_lake_replay"
              ]
            },
            "backend": {
              "type": "string",
              "enum": [
                "inline_events",
                "snowflake",
                "clickhouse",
                "databricks"
              ]
            },
            "source_skill": {
              "type": "string",
              "enum": [
                "ingest-cloudtrail-ocsf",
                "source-snowflake-query",
                "source-clickhouse-query",
                "source-databricks-query"
              ]
            },
            "records_format": {
              "type": "string",
              "enum": [
                "raw_vendor",
                "ocsf"
              ]
            },
            "query": {
              "type": "string"
            }
          }
        }
      }
    }
  },
  "$defs": {
    "model_target": {
      "type": "object",
      "additionalProperties": false,
      "required": [
        "provider",
        "model"
      ],
      "properties": {
        "provider": {
          "type": "string",
          "minLength": 1
        },
        "model": {
          "type": "string",
          "minLength": 1
        }
      }
    },
    "agent_roster_entry": {
      "type": "object",
      "additionalProperties": false,
      "required": [
        "agent_id"
      ],
      "properties": {
        "agent_id": {
          "type": "string",
          "enum": [
            "evidence-agent",
            "risk-map-agent",
            "triage-agent",
            "review-gate",
            "remediation-planner",
            "retry-coordinator",
            "escalation-agent",
            "audit-writer"
          ]
        },
        "kind": {
          "type": "string",
          "enum": [
            "deterministic_skill",
            "llm_optional",
            "human_gate",
            "governance"
          ]
        },
        "owns": {
          "type": "array",
          "minItems": 1,
          "uniqueItems": true,
          "items": {
            "type": "string",
            "enum": [
              "ingest",
              "normalize",
              "enrich",
              "correlate",
              "confidence",
              "map",
              "llm_triage",
              "review",
              "remediate",
              "retry_queue",
              "escalate",
              "writeback"
            ]
          }
        },
        "authority": {
          "type": "string",
          "minLength": 1
        },
        "privilege_boundary": {
          "type": "string",
          "enum": [
            "read_only",
            "no_tool_writes",
            "approval_context_only",
            "dry_run_write_planning",
            "retry_metadata_only",
            "queue_metadata_only",
            "append_only"
          ]
        },
        "skill_scope": {
          "type": "array",
          "uniqueItems": true,
          "items": {
            "type": "string",
            "minLength": 1
          }
        },
        "model_tier": {
          "type": "string",
          "enum": [
            "none",
            "tiny",
            "small",
            "large"
          ]
        },
        "requires_human_approval": {
          "type": "boolean"
        },
        "failure_route": {
          "type": "string",
          "enum": [
            "writeback",
            "deterministic_fallback",
            "retry_or_escalate",
            "fail_closed"
          ]
        },
        "allowed_outputs": {
          "type": "array",
          "uniqueItems": true,
          "items": {
            "type": "string",
            "minLength": 1
          }
        },
        "forbidden_outputs": {
          "type": "array",
          "uniqueItems": true,
          "items": {
            "type": "string",
            "minLength": 1
          }
        }
      }
    }
  }
}
